,id,title,publication_date,doi,cited_by_count,language,authors,locations,journal,location_count,publication_year
450,https://openalex.org/W3108551254,Virufy: Global Applicability of Crowdsourced and Clinical Datasets for AI Detection of COVID-19 from Cough Audio Samples,2020-12-02,,4,en,"Gunvant Chaudhari, Xue Jiang, Ahmed Fakhry, Areum Han, Jijie Xiao, Shuting Shen, Amil Khanzada",submittedVersion: Cornell University - https://arxiv.org/pdf/2011.13320,arXiv (Cornell University),1,2020
451,https://openalex.org/W3108916802,The Demographic Effects of Covid-19: Any Hope for Working Populations?,2021-01-01,,4,en,"Chidi Ndubuisi Olunkwa, Juliet I. Adenuga, Mohammed Bashir Salaudeen, Ekundayo Peter Mesagan",submittedVersion - https://ideas.repec.org/a/ris/buecqu/0031.html,,1,2021
452,https://openalex.org/W3110713088,Decreases in global CO$_2$ emissions due to COVID-19 pandemic,2020-04-28,,4,en,"Liu Z, Zhenhua Deng, Philippe Ciais, Ryan Lei, Shipin Feng, Davis Sj, Yeda Wang, Xuefeng Yue, Lei Ye, Hongwei Zhou, Zixin Cai, Bu Zheng, Xin Dou, Cui D, Benoît Boivin, Zhu B, Ke P, Sun T, Yuchen Wu, Rong Guo, Tao Han, Jin Xue, Frederic Chevallier, Q Zhang, Dabo Guan, Peng Gong, Kammen Dm, Schellnhuber Hj",submittedVersion - https://europepmc.org/article/PPR/PPR346543,,1,2020
453,https://openalex.org/W3114832242,Capitale sociale bonding e bridging alla prova del lockdown. Un’analisi sulle regioni italiane,2020-01-01,https://doi.org/10.1432/99055,4,en,"Salvatore Ercolano, Valerio Alfano",submittedVersion: Il Mulino - https://ideas.repec.org/a/mul/jqyfkm/doi10.1432-99055y2020i3p437-454.html,Rivista economica del Mezzogiorno,1,2020
454,https://openalex.org/W3115332055,JAPÓN Y EL COVID-19 DESDE UN PUNTO DE VISTA SOCIOCULTURAL (Japan and COVID-19 from a Socio-cultural Perspective),2020-06-01,,4,es,"von Feigenblatt, Otto Federico",submittedVersion: RELX Group (Netherlands) - https://papers.ssrn.com/sol3/papers.cfm?abstract_id=3663848,Social Science Research Network,1,2020
455,https://openalex.org/W3118411721,The impact of COVID-19 on transport and logistics connectivity in the landlocked countries of South America,2020-12-22,,4,en,Alejandra Rivera,submittedVersion: None - https://ideas.repec.org/p/ecr/col022/46528.html,Documentos de Proyectos,1,2020
456,https://openalex.org/W3120625241,CHANGE IN THE EMPLOYMENT ACTION PLANS DURING CRISIS,2020-05-21,,4,en,"Венелин Терзиев, ProQuest Central",submittedVersion: RELX Group (Netherlands) - https://papers.ssrn.com/sol3/papers.cfm?abstract_id=3610715,Social Science Research Network,1,2020
457,https://openalex.org/W3121445403,"Past Experiences, Personality Traits, and Risk Aversion: Evidence from Individual Risk Attitudes during the COVID-19 Pandemic",2021-01-06,https://doi.org/10.3868/s060-011-020-0024-4,4,en,"Yun Wang, Mingyang Yan",submittedVersion: Brill - https://academic.hep.com.cn/fec/CN/10.3868/s060-011-020-0024-4,Frontiers of Economics in China,1,2021
458,https://openalex.org/W3122236654,The COVID-19 pandemic and the revenues of state and local governments: An update,2020-01-01,,4,en,"Stan Veuger, Jeffrey Clemens",submittedVersion - https://econpapers.repec.org/article/aeijournl/y_3a2020_3aid_3a1008578025.htm,,1,2020
459,https://openalex.org/W3122416532,Stock market reactions to COVID-19 and containment policies: A panel VAR approach,2020-01-01,,4,en,"Jianfen Zhuo, Masao Kumamoto",submittedVersion: Springer Nature - https://ideas.repec.org/a/ebl/ecbull/eb-20-01157.html,Economics bulletin,1,2020
460,https://openalex.org/W3124261693,The Purchase Motivations and Continuous Use Intention of Online Subscription Services,2020-11-01,,4,en,"Yoo-Jin Kim, Boyoung Kim",submittedVersion: RELX Group (Netherlands) - https://papers.ssrn.com/sol3/Delivery.cfm/SSRN_ID3746962_code2083654.pdf?abstractid=3746962&mirid=1,Social Science Research Network,1,2020
461,https://openalex.org/W3126136160,Impact of COVID-19 on the Media System. Communicative and Democratic Consequences of News Consumption during the Outbreak,2020-04-24,,4,en,Andreu Casero-Ripollés,submittedVersion: RELX Group (Netherlands) - https://papers.ssrn.com/sol3/Delivery.cfm/SSRN_ID3594133_code2713827.pdf?abstractid=3594133&mirid=1,Social Science Research Network,1,2020
462,https://openalex.org/W3128807946,Consumer Spending and the COVID-19 Pandemic,2021-01-04,,4,en,Diego Méndez-Carbajo,submittedVersion - https://files.stlouisfed.org/research/publications/page1-econ/2021/01/04/consumer-spending-and-the-covid-19-pandemic_SE.pdf,,1,2021
463,https://openalex.org/W3131098827,2020 Global COVID-19 FinTech Regulatory Rapid Assessment Study,2020-01-01,,4,en,"Philip Rowan, Margaret Miller, Bryan Zheng Zhang, Sharmista Appaya, Sarah A. Ombija, Dea Markova, Daphnée Papiasse",submittedVersion: RELX Group (Netherlands) - https://papers.ssrn.com/sol3/papers.cfm?abstract_id=3770823,Social Science Research Network,1,2020
464,https://openalex.org/W3132121643,Future Output Loss from COVID-Induced School Closures,2021-02-16,,4,en,"John G. Fernald, Huiyu Li, Mitchell Ochse",submittedVersion: Federal Reserve Bank of San Francisco - https://www.frbsf.org/economic-research/files/el2021-04.pdf,FRB SF weekly letter,1,2021
465,https://openalex.org/W3135629082,Unequal unemployment effects of COVID-19 and monetary policy across U.S. States,2020-01-01,,4,en,Hakan Yilmazkuday,submittedVersion: None - https://econpapers.repec.org/RePEc:beh:jbepv1:v:4:y:2020:i:s3:p:45-53,Journal of Behavioral Economics for Policy,1,2020
466,https://openalex.org/W3136912302,"Speech Act Analysis of the Joseph R. Biden, Jr.’s Inaugural Address on 20th of January 2021 as the 46th President of the USA",2021-02-06,,4,en,"Hazhar Ramadhan Ahmed, Shamaila Amir",submittedVersion: RELX Group (Netherlands) - https://papers.ssrn.com/sol3/Delivery.cfm/SSRN_ID3780457_code3990137.pdf?abstractid=3780457&mirid=1,Social Science Research Network,1,2021
467,https://openalex.org/W3153241488,Efficacy of Mindfulness Meditation Intervention on Mental Health during the Times of COVID-19,2020-06-19,,4,en,Sarika Khandelwal,submittedVersion: RELX Group (Netherlands) - https://papers.ssrn.com/sol3/papers.cfm?abstract_id=3631052,Social Science Research Network,1,2020
468,https://openalex.org/W3156543750,An Integrative Conceptual Framework on Employee Performance during COVID-19 Pandemic for Bahrain SMEs,2020-11-18,,4,en,"Tamer M. Alkadash, Fatima Alamarin",submittedVersion: RELX Group (Netherlands) - https://papers.ssrn.com/sol3/Delivery.cfm/SSRN_ID3803867_code4524956.pdf?abstractid=3803867&mirid=1,Social Science Research Network,1,2020
469,https://openalex.org/W3158200516,Employers’ Investments in Job Crafting for Sustainable Employability in Pandemic Situation Due to COVID-19: A Lens of Job Demands-Resources Theory,2020-01-01,,4,en,"S Potphode Shrinivas B Kazi Irfan, Faisal Qadeer",submittedVersion: RELX Group (Netherlands) - https://papers.ssrn.com/sol3/papers.cfm?abstract_id=3770645,Social Science Research Network,1,2020
470,https://openalex.org/W3160881872,Time for Bed(s): Hospital Capacity and Mortality from COVID-19,2020-04-29,,4,en,Nathan Sussman,submittedVersion: RELX Group (Netherlands) - https://papers.ssrn.com/sol3/Delivery.cfm/SSRN_ID3588408_code30065.pdf?abstractid=3588408&mirid=1,Social Science Research Network,1,2020
471,https://openalex.org/W3163919682,Trade Policy Reflections Beyond the COVID-19 Outbreak,2020-06-02,,4,en,Lucian Cernat,submittedVersion: RELX Group (Netherlands) - https://papers.ssrn.com/sol3/papers.cfm?abstract_id=3777675,Social Science Research Network,1,2020
472,https://openalex.org/W3169710050,How has the COVID-19 crisis affected different households’ consumption in the euro area?,2021-05-31,,4,en,"Dimitris Christelis, Dimitris Georgarakos, Tullio Jappelli, Geoff Kenny",submittedVersion: Wiley - https://EconPapers.repec.org/RePEc:ecb:ecbrbu:2021:0084:,Research bulletin,1,2021
473,https://openalex.org/W3170086151,Significance of soft skills in educational process during the pandemic caused by the coronavirus COVID-19,2021-01-01,,4,en,Danijela Pezer,submittedVersion: None - https://ideas.repec.org/a/tec/journl/v20y2021i1p61-68.html,Technium Social Sciences Journal,1,2021
474,https://openalex.org/W3175718873,Investigating Pandemic Effects on Legal Academia,2021-05-10,,4,en,Meera E. Deo,submittedVersion: RELX Group (Netherlands) - https://papers.ssrn.com/sol3/papers.cfm?abstract_id=3862007,Social Science Research Network,1,2021
475,https://openalex.org/W3184215869,FORECASTING STOCK MARKET DYNAMICS USING BIDIRECTIONAL LONG SHORT-TERM MEMORY,2021-01-01,,4,en,"D. Park, Doojin Ryu",submittedVersion: None - https://ideas.repec.org/a/rjr/romjef/vy2021i2p22-34.html,Romanian Journal of Economic Forecasting,1,2021
476,https://openalex.org/W3185528076,COVID-19 and the Renewed Migration to the Rural West,2021-01-01,,4,en,"Christine Dimke, Marissa C. Lee, Jude Bayham",submittedVersion: None - https://ideas.repec.org/a/ags/weecfo/311309.html,Western Economics Forum,1,2021
477,https://openalex.org/W3188456645,"The Impact of COVID-19 on Meat Processing, and the Renewed Interest in Local Processing Capabilities",2021-01-01,https://doi.org/10.22004/ag.econ.311303,4,en,"Courtney Bir, Derrell S. Peel, Rodney B. Holcomb, Kellie Curry Raper, J.J. Jones",submittedVersion: None - https://ageconsearch.umn.edu/record/311303/files/TheImpactofCOVID19onMeatProcessing.pdf,Western Economics Forum,1,2021
478,https://openalex.org/W3192068380,COVID-19 and the increase in household savings: an update,2021-08-02,,4,en,"Maarten Dossche, Georgi Krustev, Stylianos Zlatanos",submittedVersion: None - https://econpapers.repec.org/article/ecbecbbox/2021_3a0005_3a4.htm,Economic Bulletin Boxes,1,2021
479,https://openalex.org/W3195142871,Psychische Gesundheit im zweiten Covid-19 Lockdown in Deutschland,2021-01-01,,4,en,"Theresa M. Entringer, Hannes Kröger",submittedVersion: None - https://www.econstor.eu/bitstream/10419/235757/1/1761760858.pdf,SOEPpapers on Multidisciplinary Panel Data Research,1,2021
480,https://openalex.org/W3198749667,"The Transnational Cybercrime Extortion Landscape and the Pandemic: Changes in Ransomware Offender Tactics, Attack Scalability and the Organisation of Offending",2021-08-19,,4,en,David S. Wall,submittedVersion: RELX Group (Netherlands) - https://autopapers.ssrn.com/sol3/papers.cfm?abstract_id=3908159,Social Science Research Network,1,2021
481,https://openalex.org/W3209321095,Implications of COVID-19 for conflict in Africa,2021-01-01,https://doi.org/10.23661/bp12.2021,4,en,"Charlotte Fiedler, Karina Mroß, Yonas Adaye Adeto",submittedVersion - https://www.econstor.eu/bitstream/10419/242618/1/1770452052.pdf,,1,2021
482,https://openalex.org/W3209498523,"Harvesting of Boro Paddy in Haor Areas of Bangladesh: Interplay of Local and Migrant Labour, Mechanized Harvesters and Covid-19 Vigilance in 2020",2020-01-01,,4,en,"Md. Jahangir Kabir, MS Kabir, Abdus Salam, Mohammad Ariful Islam, I. H. Ghazali bin Omar, Md. Abdur Rouf Sarkar, Mohammad Chhiddikur Rahman, Afroza Chowdhury, Md. Shajedur Rahaman, Limon Deb, Md. Abdullah Aziz, Abu Bakr Siddique, M. A. S. Mandal",submittedVersion: None - https://ideas.repec.org/p/zbw/esrepo/243304.html,EconStor Research Reports,1,2020
483,https://openalex.org/W3209985345,"COVID-19, CORONAVIRUS PANDEMIC: aproximación bibliométrica y revisión de los resultados",2020-03-31,https://doi.org/10.5281/zenodo.3734062,4,es,Rubén Alba-Ruiz,submittedVersion: European Organization for Nuclear Research - https://zenodo.org/record/3734062,Zenodo (CERN European Organization for Nuclear Research),1,2020
484,https://openalex.org/W3212438623,Leading in a VUCA World: Lessons from COVID-19,2021-11-12,,4,en,Neeraj Singhal,submittedVersion: RELX Group (Netherlands) - https://papers.ssrn.com/sol3/papers.cfm?abstract_id=3961884,Social Science Research Network,1,2021
485,https://openalex.org/W3214221844,COVID-19 Working Paper: The Effects of COVID-19 on Food Sales,2021-01-01,,4,en,"Xiao Qing Dong, Eliana Zeballos",submittedVersion - https://ideas.repec.org/p/ags/usdami/309615.html,,1,2021
486,https://openalex.org/W4200598120,An Economic Analysis of Indian Emigrants in Saudi Arabia during COVID-19 Pandemic,2021-09-28,https://doi.org/10.5281/zenodo.5774844,4,en,"Md Imran Khan, Prof. Dr Asheref Illiyan",submittedVersion: European Organization for Nuclear Research - https://zenodo.org/record/5774844,Zenodo (CERN European Organization for Nuclear Research),1,2021
487,https://openalex.org/W4226227671,"In-hospital case fatality ratio due to COVID-19 in four Brazilian state capitals and its possible temporal relationship with the Gamma variant, 2020-2021.",2021-12-02,,4,pt,"Jesem Douglas Yamall Orellana, Lihsieh Marrero, Bernardo Lessa Horta",submittedVersion: Ministry of Health of Brasil - https://doi.org/10.1590/s1679-49742021000400024,Epidemiologia e Serviços de Saúde,1,2021
488,https://openalex.org/W4287185612,"On the socio-economic impact of pandemics in Africa - Lessons learned from COVID-19, Trypanosomiasis, HIV, Yellow Fever and Cholera",2021-05-04,https://doi.org/10.5281/zenodo.4737764,4,en,Dirk Kohnert,"submittedVersion: European Organization for Nuclear Research - https://zenodo.org/record/4737764, submittedVersion: European Organization for Nuclear Research - https://zenodo.org/record/4736163, submittedVersion: European Organization for Nuclear Research - https://zenodo.org/record/4738067, submittedVersion: European Organization for Nuclear Research - https://zenodo.org/record/4740099, submittedVersion: GESIS - Leibniz-Institute for the Social Sciences - https://www.ssoar.info/ssoar/handle/document/72936, submittedVersion: Technical University of Munich - https://mpra.ub.uni-muenchen.de/107561/1/MPRA_paper_107561.pdf, submittedVersion: Federal Reserve Bank of St. Louis - https://mpra.ub.uni-muenchen.de/107591/1/MPRA_paper_107561.pdf, submittedVersion: Center for Open Science - https://osf.io/58myz/, submittedVersion: Federal Reserve Bank of St. Louis - https://osf.io/download/609067b55533b40305e1dbb1/",Zenodo (CERN European Organization for Nuclear Research),9,2021
489,https://openalex.org/W4287285375,Impact of COVID-19 outbreaks and interventions on influenza in China and the United States,2021-03-02,https://doi.org/10.5281/zenodo.4573183,4,en,Luzhao Feng,"submittedVersion: European Organization for Nuclear Research - https://zenodo.org/record/4573183, acceptedVersion: University of Southampton - https://eprints.soton.ac.uk/449701/1/s41467_021_23440_1.pdf, acceptedVersion: University of Southampton - https://eprints.soton.ac.uk/449701/2/Accepted_manuscript.pdf",Zenodo (CERN European Organization for Nuclear Research),3,2021
490,https://openalex.org/W4287650087,Impacto de la COVID-19 en el turismo mundial,2020-10-01,https://doi.org/10.5281/zenodo.6347743,4,es,"Vladimir Vega Falcón, Fernando de Jesús Castro Sánchez, Ariel José Romero Fernández",submittedVersion: European Organization for Nuclear Research - https://zenodo.org/record/6347743,Zenodo (CERN European Organization for Nuclear Research),1,2020
491,https://openalex.org/W4287819711,"Treatment of COVID-19 in peru and bolivia, and self-medication risks",2020-04-01,https://doi.org/10.5281/zenodo.6653550,4,en,"Brenda Rojas Román, Stephanie Moscoso, Sun Ah Chung, Bianca Limpias Terceros, Aldo Álvarez-Risco, Jaime A. Yáñez","submittedVersion: European Organization for Nuclear Research - https://zenodo.org/record/6653550, submittedVersion: Peruvian University of Applied Sciences - http://hdl.handle.net/10757/655706",Zenodo (CERN European Organization for Nuclear Research),2,2020
492,https://openalex.org/W4287912775,Socio-demographic and epidemiological consideration of Africa’s COVID-19 response: what is the possible pandemic course?,2020-01-01,https://doi.org/10.17615/pzy9-nq77,4,en,"B. Gaye, S. Khoury, C.W. Cene, S. Kingue, R. N apos Guetta, C. Lassale, D. Baldé, I.B. Diop, Joanna Dowd, Maxime Mills, X. Jouven",submittedVersion: University of North Carolina at Chapel Hill - https://doi.org/10.17615/pzy9-nq77,Carolina Digital Repository (University of North Carolina at Chapel Hill),1,2020
493,https://openalex.org/W4319655309,"Navigating the Post-COVID Market: A Prospective Analysis of Foreign Trade in the Pearl River Delta, China",2023-02-09,https://doi.org/10.5281/zenodo.7625190,3,en,"Peng Sun, Xiaode Zuo",submittedVersion: European Organization for Nuclear Research - https://zenodo.org/record/7625190,Zenodo (CERN European Organization for Nuclear Research),1,2023
494,https://openalex.org/W4366573707,Machine Learning Based Classification and Clustering Analysis of Efficiency of Exercise Against Covid-19 Infection,2023-04-14,https://doi.org/10.5281/zenodo.7851775,3,en,M. Sharmila Devi,"submittedVersion: European Organization for Nuclear Research - https://zenodo.org/record/7851775, submittedVersion: European Organization for Nuclear Research - https://zenodo.org/record/7407578",Zenodo (CERN European Organization for Nuclear Research),2,2023
495,https://openalex.org/W4388115481,Extensive Analysis and Projection of the Impact of High-Risk  Immunity Using a Mathematical Model That Incorporates a Convex  Incidence Rate of Multiple Covid-19 Exposures,2023-04-16,,3,en,"Mutairu Kayode Kolawole, Morufu Oyedunsi Olayiwola, Adedapo Ismaila Alaje, A. Odeyemi",submittedVersion: Istanbul University - https://dergipark.org.tr/tr/pub/cankujse/issue/80782/1277815,DergiPark (Istanbul University),1,2023
496,https://openalex.org/W4225738411,"Profile of hospital admissions and deaths due to severe acute respiratory syndrome caused by COVID-19 in Piauí, Brazil: a descriptive study, 2020-2021.",2022-01-01,,3,pt,"Eduardo Lima de Sousa, Samara Belchior Gaído, Roniele Araújo de Sousa, Osmar de Oliveira Cardoso, Emídio Marques de Matos Neto, José Maria P. Menezes, Beatriz Fátima Alves de Oliveira, Bruno Guedes Alcoforado Aguiar",submittedVersion: Ministry of Health of Brasil - https://doi.org/10.1590/s1679-49742022000100009,Epidemiologia e Serviços de Saúde,1,2022
497,https://openalex.org/W3108309407,Explainable-by-design Semi-Supervised Representation Learning for COVID-19 Diagnosis from CT Imaging,2022-01-13,https://doi.org/10.5281/zenodo.5847434,3,en,"Abel Díaz Berenguer, Hichem Sahli, Boris Joukovsky, Maryna Kvasnytsia, Ine Dirks, Mitchel Alioscha‐Perez, Nikos Deligiannis, Panagiotis Gonidakis, Sebastián Amador Sánchez, Redona Brahimetaj, Evgenia Papavasileiou, Jonathan Cheung-Wai Chan, Fei Li, Shangzhen Song, Yixin Yang, Sofie Tilborghs, Siri Willems, Tom Eelbode, Jeroen Bertels, Dirk Vandermeulen, Frederik Maes, Paul Suetens, Lucas Fidon, Tom Vercauteren, David Robben, Arne Brys, Dirk Smeets, Bart Ilsen, Nico Buls, Nina Watté, Johan De Mey, Annemiek Snoeckx, Paul M. Parizel, Julien Guiot, Louis Deprez, Paul Meunier, Stefaan Gryspeerdt, K. De Smet, Bart Jansen, Jef Vandemeulebroucke","submittedVersion: European Organization for Nuclear Research - https://zenodo.org/record/5847434, acceptedVersion: KU Leuven - https://lirias.kuleuven.be/handle/123456789/665424, submittedVersion: Vrije Universiteit Brussel - https://biblio.vub.ac.be/vubirfiles/65904474/2011.11719v2.pdf",Zenodo (CERN European Organization for Nuclear Research),3,2022
498,https://openalex.org/W4220676907,PERCEIVED SOCIAL SUPPORT AMONG PARENTS OF HOSPITALIZED CHILDREN IN THE COVID-19,2022-02-01,https://doi.org/10.5281/zenodo.5938665,3,en,"Dimitra Mourdoukouta, Maria Polikandrioti, Evangelos Dousis, Eleni Evangelou, Chrysoula Dafogianni, Ioannis Κoutelekos",submittedVersion: European Organization for Nuclear Research - https://zenodo.org/record/5938665,Zenodo (CERN European Organization for Nuclear Research),1,2022
499,https://openalex.org/W4224311969,Consumer Decisions in Consuming Eco-Friendly Food Products During the COVID-19 Pandemic: Based on Green Marketing Mix Concept,2022-04-24,https://doi.org/10.5281/zenodo.6481309,3,en,Rahmat Setiawan Tanti Handriana,submittedVersion: European Organization for Nuclear Research - https://zenodo.org/record/6481309,Zenodo (CERN European Organization for Nuclear Research),1,2022
500,https://openalex.org/W4281946948,The Implications of The Covid-19 Pandemic for The Auditing and Assurance Processes,2022-06-02,https://doi.org/10.5281/zenodo.6608444,3,en,Bushra Sarfaraj Patel,submittedVersion: European Organization for Nuclear Research - https://zenodo.org/record/6608444,Zenodo (CERN European Organization for Nuclear Research),1,2022
501,https://openalex.org/W4282839879,"Towards the emergence of a new form of the neurodegenerative Creutzfeldt-Jakob disease: Twenty six cases of CJD declared a few days after a COVID-19 ""vaccine"" Jab",2022-06-14,https://doi.org/10.5281/zenodo.6641999,3,en,"Jean claude Perez, claire Moret-Chalmin, RIP Luc Montagnier","submittedVersion: European Organization for Nuclear Research - https://zenodo.org/record/6641999, submittedVersion: European Organization for Nuclear Research - https://zenodo.org/record/6640658, submittedVersion: European Organization for Nuclear Research - https://zenodo.org/record/7304759",Zenodo (CERN European Organization for Nuclear Research),3,2022
502,https://openalex.org/W4282975895,Caspr2 autoimmune Encephalitis with COVID-19 Infection.,2022-06-01,,3,en,"M Subramanyam, Shashi Bk Gupta, Sanjiv Chamraj",submittedVersion: National Institutes of Health - https://pubmed.ncbi.nlm.nih.gov/35702850,PubMed,1,2022
503,https://openalex.org/W4283324792,An audit of a marae-based health centre management of COVID-19 community cases in South Auckland.,2022-02-04,,3,en,"Matire Harwood, Selwyn Te Paa, Nethmi Kearns, Helaman Luki, Augustus Anderson, Alex Semprini, Richard Beasley",submittedVersion: National Institutes of Health - https://pubmed.ncbi.nlm.nih.gov/35728148,PubMed,1,2022
504,https://openalex.org/W4289800424,"Depression, Anxiety and Stress Level Among Persons Deprived of Liberty, a Year after COVID-19 Pandemic: It's Implication to Jail Management",2022-08-03,https://doi.org/10.5281/zenodo.6954952,3,en,"May Ramones, Arthur Gubia-On, Peter Paul S. Cagatao",submittedVersion: European Organization for Nuclear Research - https://zenodo.org/record/6954952,Zenodo (CERN European Organization for Nuclear Research),1,2022
505,https://openalex.org/W4293679092,"COVID-19 emergency: from a general hospital to a covid hospital in one week, an Italian experience.",2022-08-31,https://doi.org/10.7416/ai.2022.2496,3,en,"Elena Azzolini, Giuseppe Furia, F Cerquetani, F Speranza, S Chiaradia, V Marchianò, M T Mainelli, M Vescia, A Zoppegno, Marisa Quintili, P Chierchini",submittedVersion: National Institutes of Health - https://pubmed.ncbi.nlm.nih.gov/36040399,PubMed,1,2022
506,https://openalex.org/W4297255163,Remarks on the management of proximal femoral fractures in times of COVID-19 pandemic.,2022-09-27,https://doi.org/10.7417/ct.2022.2453,3,en,Giuseppe Basile,submittedVersion: National Institutes of Health - https://pubmed.ncbi.nlm.nih.gov/36155723,PubMed,1,2022
507,https://openalex.org/W4308859866,Peluang dan Tantangan G20 dalam Transformasi Manajemen Pendidikan di Era Revolusi Industri 40 dan Civil Society 50 pasca Pandemi Covid-19,2022-09-30,https://doi.org/10.5281/zenodo.7316113,3,id,"Eliyunus Waruwu, Ayler Beniah Ndraha, Delipiter Lase",submittedVersion: European Organization for Nuclear Research - https://zenodo.org/record/7316113,Zenodo (CERN European Organization for Nuclear Research),1,2022
508,https://openalex.org/W4380852662,Guaranteed Financial Incentives for COVID-19 Vaccination: A Pilot Program in North Carolina,2022-01-01,https://doi.org/10.17615/wdg7-ts04,3,en,"Wong C.A., William Pilkington, Doherty I.A., Zhi-an Zhu, Hattie Gawande, Deepak Kumar, Brewer N.T.",submittedVersion: University of North Carolina at Chapel Hill - https://doi.org/10.17615/wdg7-ts04,Carolina Digital Repository (University of North Carolina at Chapel Hill),1,2022
509,https://openalex.org/W3013392660,Renin-Angiotensin-Aldosterone System: Double-Edged Sword in COVID-19 Infection,2020-03-25,,3,en,Jana Burchfield,submittedVersion - https://www.preprints.org/manuscript/202003.0365/v1,,1,2020
510,https://openalex.org/W3019483180,The post-lockdown period should be used to acquire effective therapies for future resurgence in SARS-Cov-2 infections.,2020-05-19,https://doi.org/10.26686/wgtn.12331256.v1,3,en,"Kurt L. Krause, Richard H. Furneaux, Paul Benjes, Margaret A. Brimble, Tony Davidson, William A. Denny, Lawrence D. Harris, Simon F.R. Hinkley, Peter C. Tyler, James E. Ussher, Vernon K. Ward","submittedVersion - https://doi.org/10.26686/wgtn.12331256.v1, submittedVersion: Figshare (United Kingdom) - https://figshare.com/articles/journal_contribution/The_post-lockdown_period_should_be_used_to_acquire_effective_therapies_for_future_resurgence_in_SARS-Cov-2_infections_/12331256, submittedVersion: National Institutes of Health - https://pubmed.ncbi.nlm.nih.gov/32325475",,3,2020
511,https://openalex.org/W3023266708,On Fast Multi-Shot COVID-19 Interventions for Post Lock-Down Mitigation,2020-04-27,,3,en,"Bin M, Prudence Wing Hang Cheung, Emanuele Crisostomi, P Ferraro, Hugo Lhachemi, Roderick Murray‐Smith, Connor Myant, Thomas Parisini, RJ Shorten, Samuel Stein, Lewi Stone",submittedVersion - http://export.arxiv.org/pdf/2003.09930,,1,2020
512,https://openalex.org/W3024055636,Inflation Expectations in Times of COVID-19,2020-05-13,,3,en,"Olivier Armantier, Gizem Koşar, Rachel Pomerantz, Daphné Skandalis, Kyle Smith, Giorgio Topa, Wilbert van der Klaauw",submittedVersion: None - https://fedinprint.org/item/fednls/87959,Liberty Street Economics,1,2020
513,https://openalex.org/W3025451377,"Macroeconomic Implications of the Fight against COVID-19: First Estimates, Forecasts, and Conclusions",2020-01-01,,3,en,"Victor Yotzov, Daniela Bobeva, Pobeda Loukanova, Nedialko Nestorov",submittedVersion: Routledge - https://econpapers.repec.org/RePEc:bas:econst:y:2020:i:3:p:3-28,Ikonomičeski izsledvaniâ,1,2020
