,id,title,publication_date,doi,cited_by_count,language,authors,locations,journal,location_count,publication_year
736,https://openalex.org/W3133044239,Early Evidence on the Impact of COVID-19 and the Recession on Older Workers,2020-01-01,,2,en,"Truc Thi Mai Bui, Patrick Button, Elyce G. Picciotti",submittedVersion: National Bureau of Economic Research - https://ideas.repec.org/p/nbr/nberwo/27448.html,National Bureau of Economic Research,1,2020
737,https://openalex.org/W3136103561,"Universal Masking in the United States: The Role of Mandates, Health Education, and the CDC",2020-08-10,,2,en,"Lawrence O. Gostin, I. Glenn Cohen, Jeffrey P. Koplan",submittedVersion: RELX Group (Netherlands) - https://papers.ssrn.com/sol3/papers.cfm?abstract_id=3674196,Social Science Research Network,1,2020
738,https://openalex.org/W3141519406,Advance Care Planning in Australia during the COVID-19 Outbreak: Now More Important Than Ever,2020-08-06,,2,en,"Craig Sinclair, Linda Nolte, Ben White, Karen Detering",submittedVersion: RELX Group (Netherlands) - https://autopapers.ssrn.com/sol3/papers.cfm?abstract_id=3668711,Social Science Research Network,1,2020
739,https://openalex.org/W3142219984,Evaluating Privacy During the COVID-19 Public Health Emergency: The Case of Facial Recognition Technologies,2020-09-23,,2,en,Luis Felipe M. Ramos,submittedVersion: RELX Group (Netherlands) - https://papers.ssrn.com/sol3/Delivery.cfm/SSRN_ID3729470_code2931654.pdf?abstractid=3729470&mirid=1,Social Science Research Network,1,2020
740,https://openalex.org/W3159720105,Outcomes from a COVID-19 stress test of New Zealand banks,2020-01-01,,2,en,"Chris Bloor, John Knowles, Kenneth H. Nicholls",submittedVersion: None - https://econpapers.repec.org/RePEc:nzb:nzbbul:sep2020:3,Reserve Bank of New Zealand Bulletin,1,2020
741,https://openalex.org/W3161291776,The Impact of COVID-19 on Romanian SMEs,2020-01-01,,2,en,"Elena Rusu, Anca Elena Nucu",submittedVersion: Ovidius University Press - https://doaj.org/article/21acf56073844f7fb0505f3867e7af28,Ovidius University Annals Economic Sciences Series,1,2020
742,https://openalex.org/W3162777595,On the Optimal 'Lockdown' During an Epidemic,2020-01-01,,2,en,"Martín Gonzalez-Eiras, Dirk Niepelt",submittedVersion: RELX Group (Netherlands) - https://papers.ssrn.com/sol3/papers.cfm?abstract_id=3587254,Social Science Research Network,1,2020
743,https://openalex.org/W3187668548,The Impact of COVID-19 on Emerging Stock Market Volatility: Empirical Evidence from Borsa Istanbul,2020-12-29,,2,en,İbrahim Yağlı,submittedVersion: RELX Group (Netherlands) - https://papers.ssrn.com/sol3/papers.cfm?abstract_id=3760319,Social Science Research Network,1,2020
744,https://openalex.org/W3191978418,Informality and Covid-19 in sub-Sarahan Africa,2020-10-20,,2,en,"Camilla Sacchetto, E. F. Daniel, Michael Danquah, Henry Telli",submittedVersion: London School of Economics and Political Science - http://eprints.lse.ac.uk/111562/,LSE Research Online Documents on Economics,1,2020
745,https://openalex.org/W3202532916,Madagascar’s Responses to the COVID-19 Outbreak: Educational Perspectives from March to June 2020,2020-08-09,,2,en,"Jocelyne Zafitsara, Njaratiana Mario Arthur Velo",submittedVersion: RELX Group (Netherlands) - https://papers.ssrn.com/sol3/Delivery.cfm/SSRN_ID3670329_code3990137.pdf?abstractid=3670329&mirid=1,Social Science Research Network,1,2020
746,https://openalex.org/W3214620753,The Psychological Impact of COVID-19 Lockdown Measures on Cypriots’ Mental Health and Quality of Life,2020-10-31,,2,en,"Demetris Hadjicharalambous, Stavros K. Parlalis, Koulla Erotocritou",submittedVersion: RELX Group (Netherlands) - https://papers.ssrn.com/sol3/Delivery.cfm/SSRN_ID3722584_code4192903.pdf?abstractid=3722584&mirid=1,Social Science Research Network,1,2020
747,https://openalex.org/W3215699947,Undergraduates’ Perception on E-learning Readiness during COVID-19: A Case of a Selected University in Sri Lanka,2020-10-16,,2,en,"H.M.L.P. Karunarathne, N.C. Wickramaarachchi, R. G. Ariyawansa, K.G.P.K. Weerakoon, T. M. R. Perera, P. C. Kaluthanthri, W.H.T. Gunawardhana, Lasika Madhawa Munasinghe, H. M. N. Wickramasinghe, Kasuni Rupasinghe",submittedVersion: RELX Group (Netherlands) - https://autopapers.ssrn.com/sol3/papers.cfm?abstract_id=3964371,Social Science Research Network,1,2020
748,https://openalex.org/W4213228885,Imaging COVID-19 AI initiative,2020-10-22,https://doi.org/10.26226/morressier.5f7f3e3d6934880e60c0a8ad,2,en,"Laurens Topff, Erik Ranschaert",submittedVersion - https://doi.org/10.26226/morressier.5f7f3e3d6934880e60c0a8ad,,1,2020
749,https://openalex.org/W4287558946,Photocatalytic assisted microwave-based plasma pyrolyser: A solution for COVID-19 related wastes,2020-12-01,https://doi.org/10.5281/zenodo.5656061,2,en,"S. Suresh, S. Arisutha, Sanjeev Katti, Jyoti Verma",submittedVersion: European Organization for Nuclear Research - https://zenodo.org/record/5656061,Zenodo (CERN European Organization for Nuclear Research),1,2020
750,https://openalex.org/W4287748880,COVID-ified Dentistry: Clinical Dentistry in COVID Era,2020-06-30,https://doi.org/10.5281/zenodo.3931613,2,en,"G Rajalakshmi, K Sarika",submittedVersion: European Organization for Nuclear Research - https://zenodo.org/record/3931613,Zenodo (CERN European Organization for Nuclear Research),1,2020
751,https://openalex.org/W4287797152,Statistical review of Efficacy and safety of lopinavir/ritonavir or arbidol in adult patients with mild/moderate COVID-19: an exploratory randomized controlled trial,2020-05-01,https://doi.org/10.5281/zenodo.3779933,2,en,"Kerenza Hood, Darren Dahly, Jack Wilkinson",submittedVersion: European Organization for Nuclear Research - https://zenodo.org/record/3779933,Zenodo (CERN European Organization for Nuclear Research),1,2020
752,https://openalex.org/W4295107522,COVID-19 ve Psikiyatrik Bozukluklar,2020-08-05,,2,tr,"İhsan OKUR, Ömer Faruk Demirel",submittedVersion: Istanbul University - https://dergipark.org.tr/tr/pub/mrr/issue/56260/764249,DergiPark (Istanbul University),1,2020
753,https://openalex.org/W4386888203,Covidpreprints.com: Automating Website Updates with the europepmc and rAltmetric Packages,2020-10-13,https://doi.org/10.59350/mq7wm-qnw63,2,en,"Zhang-He Goh, Jonathon Alexis Coates, Hugo Gruson",submittedVersion - https://doi.org/10.59350/mq7wm-qnw63,,1,2020
754,https://openalex.org/W3011520845,Embracing complexity: COVID-19 is a case for academic collaboration and co-creation,2020-03-17,https://doi.org/10.5281/zenodo.3712898,2,en,Benedikt Fecher,submittedVersion: European Organization for Nuclear Research - https://zenodo.org/record/3712898,Zenodo (CERN European Organization for Nuclear Research),1,2020
755,https://openalex.org/W3018465946,COVID-19 in Italy: An app for a province-based analysis,2020-04-24,,2,en,"Luisa Ferrari, G Gerardi, Giancarlo Manzi, Angelo Micheletti, Federica Nicolussi, Silvia Salini",submittedVersion - https://europepmc.org/article/PPR/PPR346518,,1,2020
756,https://openalex.org/W3018586512,Proof-of-concept of a minimalist pressure-controlled emergency ventilator for COVID-19,2020-04-01,,2,en,"A Pereira, Paula Fonte, Pedro Póvoa, Santos Tg, Ana Pinto-Martinho, António Bugalho, A Gabriel-Santos, Pimenta Ggb, J.C. Góes, Julian Märtins, Oliveira Jp, Santos Jp, Gil Lc, L Lopes, Domingues Mo, O Cunha, Sousa PPd, TA Rodrigues, Duarte Vr, Nascimento JAd, Ana Grilo, Allen Po",submittedVersion - https://europepmc.org/article/PPR/PPR346178,,1,2020
757,https://openalex.org/W3019243190,Alternating quarantine for sustainable mitigation of COVID-19,2020-04-26,,2,en,"Dror Meidan, N Schulamann, R. Cohen, Spencer Haber, Eyal Yaniv, Ronit Sarid, Baruch Barzel",submittedVersion: Cornell University - https://arxiv.org/pdf/2004.01453,arXiv (Cornell University),1,2020
758,https://openalex.org/W3021057156,Implication of Inter-State Movement of Migrant Workers during COVID 19 Lockdown using Modified SEIR Model,2020-05-09,,2,en,"Avijit Maji, M. B. Sushma, Tushar Choudhari",submittedVersion - https://europepmc.org/article/PPR/PPR346665,,1,2020
759,https://openalex.org/W3021331672,Análise das primeiras respostas políticas do Governo Brasileiro para o enfrentamento da COVID-19 disponíveis no Repositório Global Polimap,2020-01-01,,2,pt,"Fernanda Cimini Salles, Nayara Abreu Julião, Aline de Souza, João Victor Simões Ferreira, Guilherme Rodrigues de Figueiredo",submittedVersion - https://ideas.repec.org/p/cdp/tecnot/tn013.html,,1,2020
760,https://openalex.org/W3021345837,The pandemic threatens aged rural regions most,2020-01-01,,2,en,"Ilya Kashnitsky, Josè Manuel Aburto",submittedVersion: None - https://ideas.repec.org/p/osf/osfxxx/abx7s.html,OSF Preprints,1,2020
761,https://openalex.org/W3021987178,"The Impact of COVID-19 on Iowa’s Corn, Soybean, Ethanol, Pork, and Beef Sectors",2020-01-01,,2,en,"Chad E. Hart, Dermot J. Hayes, Keri Jacobs, Lee Schulz, John M. Crespi",submittedVersion: Wiley - https://works.bepress.com/chad-hart/214/,American journal of agricultural economics,1,2020
762,https://openalex.org/W3022086419,SISTEMA DE SAÚDE PÚBLICO NO BRASIL E A PANDEMIA DO NOVO CORONAVÍRUS,2020-05-01,https://doi.org/10.5281/zenodo.3759724,2,pt,"Francisleile Lima Nascimento, Alberto do Espírito Santos Dantas Pacheco Pacheco",submittedVersion: European Organization for Nuclear Research - https://zenodo.org/record/3759724,Zenodo (CERN European Organization for Nuclear Research),1,2020
763,https://openalex.org/W3022240134,Quantifying Projected Impact of Social Distancing Policies on COVID-19 Outcomes in the US,2020-04-30,,2,en,"Chaoqi Yang, Ruijie Wang, Fangwei Gao, Dachun Sun, Jiawei Tang, Tarek Abdelzaher",submittedVersion - https://europepmc.org/article/PPR/PPR346583,,1,2020
764,https://openalex.org/W3023957649,Dealing with the costs of the COVID-19 pandemic – what are the fiscal options?,2020-01-01,,2,en,"Gene Ambrocio, Mikael Juselius",submittedVersion - https://www.econstor.eu/bitstream/10419/215777/1/BoFER-2-2020.pdf,,1,2020
765,https://openalex.org/W3024504543,The Dark Side of Videoconferencing: The Privacy Tribulations of Zoom and the Fragmented State of U.S. Data Privacy Law,2020-05-11,,2,en,Michael Goodyear,submittedVersion: RELX Group (Netherlands) - https://papers.ssrn.com/sol3/papers.cfm?abstract_id=3599428,Social Science Research Network,1,2020
766,https://openalex.org/W3024626475,"Estimating the monetary value of the deaths prevented from the UK Covid-19 lockdown when it was decided upon -- and the value of ""flattening the curve""",2020-04-18,,2,en,"Paul Dolan, Pinar Jenkins",submittedVersion: London School of Economics and Political Science - http://eprints.lse.ac.uk/104355/,LSE Research Online Documents on Economics,1,2020
767,https://openalex.org/W3025974682,Tracking and Analyzing the Short-Run Impact of COVID-19 on the U.S. Electricity Sector,2020-05-11,,2,en,"Guangchun Ruan, Dui Wu, Xiyuan Zheng, S. Sivaranjani, Xie Li, Haiwang Zhong, Cheul Kang",submittedVersion: Cornell University - https://arxiv.org/pdf/2005.06631,arXiv (Cornell University),1,2020
768,https://openalex.org/W3028655757,The Primary and Secondary Market Corporate Credit Facilities,2020-05-26,,2,en,"Nina Boyarchenko, Richard K. Crump, Anna Kovner, Or Shachar, Peter Van Tassel",submittedVersion: None - https://fedinprint.org/item/fednls/88048,Liberty Street Economics,1,2020
769,https://openalex.org/W3029669726,Heterogeneidad en el impacto económico del COVID-19 entre regiones y países del área del euro,2020-05-27,,2,es,"Elvira Prades Illanes, Patrocinio Tello Casas",submittedVersion: None - https://repositorio.bde.es/bitstream/123456789/12701/1/be2002-art17.pdf,Boletín económico - Banco de España,1,2020
770,https://openalex.org/W3034338176,Neustart der Industrie unter dem Einfluss von Covid-19: Wie bereit ist die globale Lieferkette?,2020-01-01,,2,de,"Holger Görg, Saskia Mösle, Thieß Petersen, Hartmut Egger, Kemal Kılıç, Dalia Marin, Lisandra Flach, Rahel Aichele, Martin Braml, Ralph Wiechers, Thomas Steinwachs, Morris Hosseini, Michael Baur, Kai Joachimsen, R. Bogaschewsky",submittedVersion: None - https://www.econstor.eu/bitstream/10419/225129/1/ifo-sd-2020-05-p03-34.pdf,Ifo-Schnelldienst,1,2020
771,https://openalex.org/W3034841023,When your lab is the world but the world is closed down - Social Science Research in times of Covid-19,2020-06-09,https://doi.org/10.5281/zenodo.3885618,2,en,Samantha Ruppel,submittedVersion: European Organization for Nuclear Research - https://zenodo.org/record/3885618,Zenodo (CERN European Organization for Nuclear Research),1,2020
772,https://openalex.org/W3034986804,How Fed Swap Lines Supported the U.S. Corporate Credit Market amid COVID-19 Strains,2020-06-12,,2,en,"Nicola Cetorelli, Linda S. Goldberg, Fabiola Ravazzolo",submittedVersion: None - https://fedinprint.org/item/fednls/88138,Liberty Street Economics,1,2020
773,https://openalex.org/W3036113000,Patterns Of Mainly Tourism Sectors At Local Level By Employee'S Characteristics Using Gis Multivariate Clustering Analysis - Romania Case Study,2020-01-01,,2,en,"Cristina Lincaru, Speranța Pîrciog, Draga Atanasiu, Cristina Stroe, Vasilica Ciucă, Adriana Grigorescu",submittedVersion: None - https://ideas.repec.org/a/hrs/journl/vxiiy2020i1p261-290.html,Regional Science Inquiry,1,2020
774,https://openalex.org/W3037671321,THE PSYCHOLOGICAL EFFECT OF THE COVID-19 PANDEMIC IN TURKEY AND THE WORLD AT THE CONTEXT OF POLITICAL PSYCHOLOGY,2020-06-25,,2,en,"Charlene Erica DUSHIME, Saman Hashemipour",submittedVersion: Istanbul University - https://dergipark.org.tr/tr/pub/asead/issue/55211/749653,DergiPark (Istanbul University),1,2020
775,https://openalex.org/W3038497200,O PAPEL DA GEOGRAFIA DIANTE DA PANDEMIA DA COVID-19,2020-06-26,https://doi.org/10.5281/zenodo.3909889,2,pt,Victor Hugo Nedel Oliveira,submittedVersion: European Organization for Nuclear Research - https://zenodo.org/record/3909889,Zenodo (CERN European Organization for Nuclear Research),1,2020
776,https://openalex.org/W3042624457,Characterization of Potential Drug Treatments for COVID-19 using Social Media Data and Machine Learning,2020-07-20,,2,en,"Ramya Tekumalla, Juan M. Banda",submittedVersion - https://europepmc.org/article/PPR/PPR347171,,1,2020
777,https://openalex.org/W3044258791,The impact of COVID-19 on hotel performance: Evidence from a Difference-in-Differences approach,2020-07-25,,2,en,Michael Polemis,submittedVersion: None - https://mpra.ub.uni-muenchen.de/102053/,MPRA Paper,1,2020
778,https://openalex.org/W3044842787,Deconstructing Sustainable Livelihood Framework (SLF) for Equitable Living in Crisis of Global Pandemic,2020-04-06,,2,en,Emerson Abraham Jackson,submittedVersion: None - https://ideas.repec.org/p/pra/mprapa/101977.html,MPRA Paper,1,2020
779,https://openalex.org/W3048270265,Paracetamol use in COVID-19: friend or enemy?,2020-08-07,,2,en,"Piero Sestili, Carmela Fimognari",submittedVersion - https://www.preprints.org/manuscript/202008.0186/v1,,1,2020
780,https://openalex.org/W3048284538,An Overview of Algorithmic Trading in Foreign Exchange Markets and Its Impacts on Market Liquidity,2020-01-01,,2,en,"Fukuma Noritaka, Kadogawa Yoichi",submittedVersion - https://ideas.repec.org/p/boj/bojrev/rev20e05.html,,1,2020
781,https://openalex.org/W3048453667,Pre-symptomatic Transmission in the Evolution of the COVID-19 Pandemic,2020-03-16,,2,en,"Lijun Tian, Xin Li, Feng Qi, Qiuling Tang, Gong‐You Tang, Jing Liu, Xinge Cheng, Yong Shi, Honglin Liu, Lixin Tang",submittedVersion - https://europepmc.org/article/PPR/PPR346000,,1,2020
782,https://openalex.org/W3081132039,Stochastic or Deterministic? That is the Question,2020-10-28,https://doi.org/10.13133/2532-5876/16955,2,en,Andràs Páldi,submittedVersion - https://hal.science/hal-04025563,,1,2020
783,https://openalex.org/W3081737268,Adjusting the Unemployment Thermometer,2020-09-03,,2,en,"Régis Barnichon, Winnie Yee",submittedVersion: Federal Reserve Bank of San Francisco - https://www.frbsf.org/economic-research/publications/economic-letter/2020/september/adjusting-unemployment-thermometer/el2020-27.pdf,FRB SF weekly letter,1,2020
784,https://openalex.org/W3083278105,"COVID-19 PANDEMIC AND PERFORMANCE OF SMALL AND MEDIUM SCALE ENTERPRISES (SMES) IN LOKOJA, KOGI STATE, NIGERIA",2020-01-01,,2,en,"Enemona Negedu Ameji, Muhammed Akpai Amade, Usio Uchechi Taiga",submittedVersion - https://econpapers.repec.org/RePEc:ris:ilojep:0033,,1,2020
785,https://openalex.org/W3083630247,Weibo-COV: A Large-Scale COVID-19 Tweets Dataset from Webio,2020-05-18,,2,en,"Yunfeng Hu, Hongbo Huang, A Chen, Mao X",submittedVersion: Cornell University - https://arxiv.org/pdf/2005.09174,arXiv (Cornell University),1,2020
786,https://openalex.org/W3083942887,Dramatic Clinical Improvement in Nine Consecutive Acutely Ill Elderly COVID-19 Patients Treated with a Nicotinamide Mononucleotide Cocktail: A Case Series,2020-08-17,,2,en,Robert Huizenga,submittedVersion: RELX Group (Netherlands) - https://papers.ssrn.com/sol3/papers.cfm?abstract_id=3677428,Social Science Research Network,1,2020
787,https://openalex.org/W3085545645,Wie wirkt sich Covid-19 auf Migration und Integration aus?,2020-01-01,,2,de,"Yvonne Giesing, Maria Hofbauer",submittedVersion: None - https://www.econstor.eu/bitstream/10419/225152/1/ifo-sd-2020-07-p41-46.pdf,Ifo-Schnelldienst,1,2020
788,https://openalex.org/W3087072000,DIFICULDADES DE JOVENS SEM VÍNCULO FORMAL DE EMPREGO DURANTE A PANDEMIA DA COVID-19: LIMITES DO EMPREENDEDORISMO EM TEMPOS DE CRISE,2020-09-01,https://doi.org/10.5281/zenodo.4009914,2,pt,"Evelyn de Souza Lima, Kamila Eulálio Abreu",submittedVersion: European Organization for Nuclear Research - https://zenodo.org/record/4009914,Zenodo (CERN European Organization for Nuclear Research),1,2020
789,https://openalex.org/W3087661149,ENSINO REMOTO EM TEMPOS DE COVID-19: APLICAÇÕES E DIFICULDADES DE ACESSO NOS ESTADOS DO PIAUÍ E MARANHÃO,2020-09-07,https://doi.org/10.5281/zenodo.4018034,2,pt,"Manoel Cícero Ribeiro Júnior, Luciano Silva Figueirêdo, Dalila Coragem Alves de Oliveira, Márcia Percília Moura Parente, Jeisy dos Santos Holanda",submittedVersion: European Organization for Nuclear Research - https://zenodo.org/record/4018034,Zenodo (CERN European Organization for Nuclear Research),1,2020
790,https://openalex.org/W3087709615,When more delivers less: Comparing the US and French COVID-19 crisis responses,2020-01-01,,2,en,"JÃ©rÃ©mie Cohen-Setton, Jean Pisani‐Ferry",submittedVersion: None - https://ideas.repec.org/p/iie/pbrief/pb20-9.html,Policy briefs,1,2020
791,https://openalex.org/W3087823474,Diferencias regionales del impacto del confinamiento en Colombia,2020-01-01,,2,es,"Gustavo Adolfo Hernández-Diaz, Luis Felipe Herrera Quintero",submittedVersion - https://ideas.repec.org/p/col/000118/018428.html,,1,2020
792,https://openalex.org/W3088692920,COVID -19 Crisis in Africa: Leveraging FinTech and RegTech for Economic Recovery,2020-11-19,,2,en,Iwa Salami,submittedVersion: RELX Group (Netherlands) - https://papers.ssrn.com/sol3/papers.cfm?abstract_id=3733468,Social Science Research Network,1,2020
793,https://openalex.org/W3089630391,Health Care Fraud Means Never Having to Say You're Sorry,2020-07-28,,2,en,Jacob T. Elberg,submittedVersion: RELX Group (Netherlands) - https://papers.ssrn.com/sol3/papers.cfm?abstract_id=3675931,Social Science Research Network,1,2020
794,https://openalex.org/W3089759398,Gendered Complications of COVID-19: Towards a Feminist Recovery Plan,2020-10-16,,2,en,"Naomi Cahn, Linda C. McClain",submittedVersion: RELX Group (Netherlands) - https://papers.ssrn.com/sol3/papers.cfm?abstract_id=3689285,Social Science Research Network,1,2020
795,https://openalex.org/W3090257797,COVID-19 and social protection in South Asia: Bangladesh,2020-01-01,,2,en,"Fabianna Bacil, Gabriel Soyer",submittedVersion: None - https://ideas.repec.org/p/ipc/opager/448.html,One Pager,1,2020
796,https://openalex.org/W3094060211,COVID-19 y shock externo: impactos económicos y opciones de política en el Perú,2020-06-01,,2,es,"Miguel Jaramillo, Hugo Ñopo",submittedVersion - http://repositorio.grade.org.pe/handle/20.500.12820/579,,1,2020
797,https://openalex.org/W3094517691,"Early estimates of the impact of COVID-19 disruptions on jobs, wages, and lifetime earnings of schoolchildren in Australia",2020-01-01,,2,en,Gigi Foster,submittedVersion: None - https://ideas.repec.org/a/ozl/journl/v23y2020i2p129-151.html,Australian journal of labour economics,1,2020
798,https://openalex.org/W3095482687,Sharing the Pain: How Did Boards Adjust CEO Pay in Response to COVID-19?,2020-09-01,,2,en,"Amit Batish, Andrew C. Gordon, David F. Larcker, Brian Tayan, Edward M. Watts, Courtney Yu",submittedVersion: RELX Group (Netherlands) - https://autopapers.ssrn.com/sol3/papers.cfm?abstract_id=3682766,Social Science Research Network,1,2020
799,https://openalex.org/W3096582863,High prevalence of SARS-CoV-2 swab positivity and increasing R number in England during October 2020: REACT-1 round 6 interim report,2020-11-03,https://doi.org/10.1101/2020.10.30.20223123v1,2,en,"Steven Riley, Ainslie Kec., Oliver Eales, C Walters, Haowei Wang, CJ Atchinson, Claudio Fronterrè, Peter J. Diggle, Deborah Ashby, Christl A. Donnelly, Graham Cooke, William Barclay, Helen Ward, Ara Darzi, Paul Elliott",submittedVersion: Cold Spring Harbor Laboratory Press - https://www.medrxiv.org/content/medrxiv/early/2020/11/03/2020.10.30.20223123.full.pdf,medRxiv,1,2020
800,https://openalex.org/W3097539000,401(k)/IRA Holdings in 2019: An Update from the SCF,2020-01-01,,2,en,"Alicia H. Munnell, Anqi Chen",submittedVersion: None - https://ideas.repec.org/p/crr/issbrf/ib2020-14.html,Issues in Brief,1,2020
801,https://openalex.org/W3100005267,Empirical Review on Tourism Demand and COVID-19,2020-11-08,,2,en,Meng-Chang Jong,submittedVersion: None - https://ideas.repec.org/p/pra/mprapa/103919.html,MPRA Paper,1,2020
802,https://openalex.org/W3106914042,"Risks, resilience, and pathways to sustainable aviation: A COVID-19 perspective",2020-01-01,,2,en,Stefan GÃ¶ssling,submittedVersion: Elsevier BV - https://ideas.repec.org/a/eee/jaitra/v89y2020ics0969699720305160.html,Journal of air transport management,1,2020
803,https://openalex.org/W3107292372,Covid Perpetual Eurobonds: Jointly guaranteed and supported by the ECB,2020-01-01,,2,en,"Francesco Giavazzi, Guido Tabellini",submittedVersion - https://ideas.repec.org/h/cpr/ebchap/p328-34.html,,1,2020
804,https://openalex.org/W3107365386,Alternative Macro Policy Response for a Pandemic Recession,2020-01-01,,2,en,Jan Kregel,submittedVersion - https://ideas.repec.org/p/lev/levypn/20-6.html,,1,2020
805,https://openalex.org/W3107553931,Implicaciones ontológicas en el aprendizaje a partir del distanciamiento social impuesto por la pandemia COVID-19,2020-10-14,https://doi.org/10.5281/zenodo.4087453,2,es,"Carlos Andrés Trejos-Gil, Huber Yecid Castro-Escobar","submittedVersion: European Organization for Nuclear Research - https://zenodo.org/record/4087453, acceptedVersion: University of Naples Federico II - http://eprints.rclis.org/40584/1/Trejos_Gil_2020_Implicaciones%20Ontolo%CC%81gicas%20en%20CoVid_COTABLI.pdf",Zenodo (CERN European Organization for Nuclear Research),2,2020
806,https://openalex.org/W3111341980,Update on the Economic Well-Being of U.S. Households: July 2020 Results,2020-09-01,,2,en,"Sara Canilang, Kayla Jones, Jeff Larrimore, Ellen A. Merry, Mike Zabek",submittedVersion - https://fedinprint.org/item/g00002/89636,,1,2020
807,https://openalex.org/W3113288960,Facing The New Learning Normality - Europe At A Glance In The Context Of Coronavirus Pandemic,2020-01-01,,2,en,"Bogoslov Ioana Andreea, Anca Elena Lungu",submittedVersion: None - https://ideas.repec.org/a/blg/reveco/v72y2020i1p25-36.html,Revista Economica,1,2020
808,https://openalex.org/W3114971657,"The impact of COVID-19 on developing Asian economies: The role of outbreak severity, containment stringency, and mobility declines",2020-01-01,,2,en,"Abdul Abiad, Mia Arao, Editha Laviña, Reizle Platitas, Jesson Pagaduan, Christian Regie Jabagat",submittedVersion - https://ideas.repec.org/h/cpr/ebchap/p330-05.html,,1,2020
809,https://openalex.org/W3119142407,Assessments on the Effects of the Coronavirus Pandemic on the Economies of the Central and South-East European Union Countries,2020-01-01,,2,en,Tiberiu Cristian AvrÄƒmescu,submittedVersion: Ovidius University Press - https://ideas.repec.org/a/ovi/oviste/vxxy2020i1p105-112.html,Ovidius University Annals Economic Sciences Series,1,2020
810,https://openalex.org/W3119322408,Household food security in the United States in 2019,2020-01-01,,2,en,"Alisha Coleman‐Jensen, Matthew P. Rabbitt, Christian Gregory, Anita Singh",submittedVersion - https://ideas.repec.org/p/ags/uerser/305691.html,,1,2020
811,https://openalex.org/W3119887759,The EU needs an independent public health authority to fight pandemics such as the COVID-19 crises,2020-01-01,,2,en,Joan Costa‐Font,submittedVersion - https://ideas.repec.org/h/cpr/ebchap/p328-03.html,,1,2020
812,https://openalex.org/W3120088638,Protecting the Rights of People with Disabilities,2020-08-18,,2,en,Elizabeth Pendo,submittedVersion: RELX Group (Netherlands) - https://autopapers.ssrn.com/sol3/papers.cfm?abstract_id=3675789,Social Science Research Network,1,2020
813,https://openalex.org/W3120678079,IZA COVID-19 Crisis response monitoring: The second phase of the crisis,2021-01-01,,2,en,"Werner Eichhörst, Paul Marx, Ulf Rinne, René Böheim, Thomas Leoni, Steven Tobin, Arthur Sweetman, Priscila de Freitas Ferreira, João Cerejeira, Miguel Portela",submittedVersion: None - https://repositorium.sdum.uminho.pt/bitstream/1822/72582/1/iza_report_105.pdf,IZA Research Reports,1,2021
